{
  "id": "mastery.a1b2c3",
  "entity_type": "mastery_profile",
  "schema_version": "1.0.0",
  "learner_id": "user.demo",
  "target_ref": {
    "entity_type": "topic",
    "id": "nt.divisibility-gcd-prime-factorization"
  },
  "mastery_score": 0.58,
  "mastery_level": "functional",
  "confidence_score": 0.72,
  "evidence_count": 4,
  "computed_at": "2026-03-08T10:05:00Z",
  "last_interacted_at": "2026-03-08T10:05:00Z",
  "audit": {
    "created_at": "2026-03-08T10:00:00Z",
    "updated_at": "2026-03-08T10:05:00Z",
    "created_by": "system.seed",
    "updated_by": "system.seed"
  }
}
